"twitter_id"	"is_1"	"is_2"	"is_3"	"name"	"screen_name"	"description"	"verified"	"location"	"lat"	"lon"	"country"	"country_code"	"created_at"	"followers_count"	"friends_count"	"statuses_count"	"favourites_count"	"listed_count"
317964601	1	0	0	"Khaleesi Marie"	"Helen_Kelser"	"Apologetically myself."	False	""	""	""	""	""	"2011-06-15 19:09:05+00:00"	337.0	280.0	23160.0	10319.0	3.0
318013660	0	0	1	"Claire"	"bazinga02"	"Some think I'm crazy but normal is over rated! Workaholic & Soccer mad ManUtd supporter. Lover of good music & often of cheezy tunes that no1 else appreciates:)"	False	"jo burg south africa"	""	""	""	""	"2011-06-15 20:40:12+00:00"	44.0	253.0	349.0	6.0	1.0
318081821	1	0	0	"Gabriya Martell"	"Myrtle_Sue"	"I'm lame, awkward, weird, shy, and socially challenged #NSU15 Mother of Dragons Starbucks is my queen     Netflix is my wife       Pizza is my mistress"	False	"westeros"	""	""	""	""	"2011-06-15 23:05:14+00:00"	336.0	325.0	22113.0	4328.0	2.0
318351989	0	0	1	"Bows"	"JayeBowen"	"⚽️⚽️ ... sheldon x - insta:jayebowen snap chat - jaye.bowen #20"	False	"newport"	12.05	-68.81667	"Newport"	"CW"	"2011-06-16 10:43:51+00:00"	2172.0	503.0	6203.0	1315.0	8.0
318850011	1	0	0	"Marlo Martel "	"J_Martel24"	"Doing What I Gotta Do To Do What I Wanna Do.Live&Learn& Never Make The Same Mistake Twice.Childersburg to AU"	False	"auburn  al  childersburg al"	""	""	""	""	"2011-06-17 04:31:22+00:00"	1196.0	878.0	27137.0	448.0	0.0
319292111	1	0	0	"CM."	"CurtisMacleod95"	"Game Of Thrones // Ed Sheeran // You Me At Six // Liverpool Football Club // Lauren & Archie x"	False	"united kingdom"	54.75844	-2.69531	"United Kingdom"	"GB"	"2011-06-17 21:41:56+00:00"	75409.0	35034.0	14834.0	5866.0	23.0
320065459	1	0	0	"Red As God ♕"	"UKNOWuGotIt"	"TVXQ = Yunho & Changmin . I do NOT have a stance, so think twice before you claim me belong to any sides."	False	"jurasshinki world "	""	""	""	""	"2011-06-19 07:16:33+00:00"	2141.0	327.0	106320.0	2015.0	19.0
320437832	0	0	1	"naina"	"nainacious"	"as lame as 'teri meri story jese big bang theory,mai sunau chori chori ye sabko'"	False	"punekar"	""	""	""	""	"2011-06-19 22:31:24+00:00"	992.0	163.0	19857.0	10588.0	27.0
320934167	0	1	0	"James Matthews"	"JamesMatthews87"	""	False	"swansea"	51.62079	-3.94323	"Swansea"	"GB"	"2011-06-20 19:20:56+00:00"	94.0	371.0	602.0	60.0	2.0
320971470	0	1	0	"Frank Underwood"	"AllanIverson23"	"I am brave. Roller coasters? Love ‘em. Scary movies? I’ve seen Ghostbusters, like, seven times"	False	"london"	51.50853	-0.12574	"London"	"GB"	"2011-06-20 20:31:23+00:00"	116.0	203.0	1543.0	47.0	0.0
321619369	1	0	0	"Eric Young"	"LordSnow317"	"Current ne'er-do-well. Aspiring ghostwriter."	False	"indianapolis"	39.76838	-86.15804	"Indianapolis"	"US"	"2011-06-21 21:27:00+00:00"	197.0	1100.0	5510.0	1435.0	6.0
321980548	0	0	1	"Dr. Sheldon Cooper"	"SheldonCooper13"	"•Caltech Theoretical Physicist:
•B.S, M.S, M.A, Ph.D, Sc.D... OMG Right!!!
#BAZINGA!!!"	False	"pasadena  ca  usa"	34.14778	-118.14452	"Pasadena"	"US"	"2011-06-22 13:04:06+00:00"	1293.0	20.0	646.0	0.0	19.0
322176829	0	0	1	"Juliann Sheldon"	"JuliannSheldon"	"Public Relations Specialist. Former Miss Pennsylvania. Mental Health Advocate. Dancer. Kitty-mama IG: juliannsheldon My thoughts are my own."	False	""	""	""	""	""	"2011-06-22 19:13:42+00:00"	1323.0	742.0	3734.0	1795.0	22.0
322335923	0	0	1	"Whovian_PD "	"clever_who"	"#DoctorWho #Supernatural #AgentsOfSHIELD #Arrow #Merlin #Sherlock #StarWars #Marvel #49ers :)"	False	"california  usa     uc davis"	38.4471	-121.8549	"Super 8 Dixon / UC Davis"	"US"	"2011-06-23 00:54:51+00:00"	481.0	500.0	5627.0	5594.0	12.0
322435482	0	1	0	"Remy Danton"	"Tdurty15"	"My dad dressed up as Batman at my 6th birthday party. He threw down a smoke bomb and I aint seen him since"	False	"hyde park"	51.50735	-0.16571	"Hyde Park"	"GB"	"2011-06-23 05:01:29+00:00"	376.0	204.0	3873.0	694.0	1.0
322786990	0	0	1	"Mandy care"	"Daisyrascal66"	"fab good brill bazinga"	False	"norfolk "	-29.03333	167.95	"Norfolk Island"	"NF"	"2011-06-23 18:59:10+00:00"	468.0	1205.0	2776.0	400.0	6.0
322962900	0	1	0	"Matthew James"	"mattjamesart"	"Matthew James is a designer / artist. A cast member on Chris March's Mad Fashion Bravo , and designer for Beach Blanket Babylon"	False	""	""	""	""	""	"2011-06-24 01:22:32+00:00"	195.0	56.0	1191.0	8.0	5.0
323562282	1	0	0	"YGG Lor Stackks"	"iGotDem_Stackks"	"Young Talented Baltimore Artist Shagg-(S)top(H)ating(A)nd(G)o(G)rind #Shaggang #YGG #email:@barbontv@yahoo.com"	False	"baltimore md"	""	""	""	""	"2011-06-25 01:34:22+00:00"	8087.0	416.0	12308.0	2280.0	7.0
323842809	0	0	1	"Jenny Bean"	"Jenny_Bean_10"	"Pokemon, Doctor Who, Star Trek, TBBT, Sherlock, Ben C, Tom H, Marvel, Spn, Elementary, OUAT, House MD, Divergent, Buffy"	False	"the enchanted forest"	""	""	""	""	"2011-06-25 14:42:46+00:00"	785.0	1976.0	2670.0	795.0	14.0
323944705	1	0	0	"Liam Feeney"	"Feens11"	"Professional footballer for Bolton Wanderers fc"	True	"london manchester"	51.51872	-0.1539	"Ten Manchester Street"	"GB"	"2011-06-25 18:17:10+00:00"	8889.0	215.0	498.0	36.0	51.0
324025496	0	0	1	"Just the Doctor :p"	"SFTxCallum"	"I'm 19 and from Earth. UK. Whovian, Sherlockian, TWD, TBBT & many others. Allons-y! Property of Lizzy Ecart"	False	"the tardis"	""	""	""	""	"2011-06-25 21:24:47+00:00"	662.0	1084.0	13301.0	465.0	4.0
324439511	1	0	0	"Rémy©"	"iRemyGotSwag"	"PRemy Marketing Group || I'm not here to make friends, I'm here to make money - #LifeIsGood #GodIsGreat"	False	"    somewhere building my brand "	""	""	""	""	"2011-06-26 16:32:15+00:00"	2005.0	794.0	101854.0	401.0	15.0
324459095	0	1	0	"Stan Matthews"	"Janitor_Jim"	"These blast points are too accurate for Sand People..."	False	"gravesend"	-29.58326	150.33314	"Gravesend"	"AU"	"2011-06-26 17:14:59+00:00"	59.0	61.0	423.0	0.0	0.0
324683692	0	0	1	"Tea Story"	"TeaStoryCafe"	"We are Winnipeg first tea cafes offer over 120 varieties of premium teas, fresh fruit BBT & unique gourmet savory and sweet waffles w vegan, gulten-free option"	False	"    osborne  wpg"	""	""	""	""	"2011-06-27 01:48:41+00:00"	856.0	1996.0	280.0	13.0	20.0
325142397	1	0	0	"Thebar Bolton"	"Thebarbolton"	"Bolton's exclusive bar. A sophisticated lounging experience with the finest ambience, impeccable service & with premium spirits, champagnes & cocktails."	False	"nelson sq  bolton  bl   jt"	""	""	""	""	"2011-06-27 20:15:57+00:00"	2595.0	2133.0	3266.0	73.0	15.0
325192873	1	0	0	"Morgan Martells"	"morgan_rose33"	"❤️"	False	"sterling  illinois"	41.78864	-89.69622	"Sterling"	"US"	"2011-06-27 22:02:12+00:00"	314.0	304.0	4693.0	1521.0	1.0
326407217	1	0	0	"ســــــاندي ϟ"	"SandyyyKOP"	"I am an Elf who wants to go to Hogwarts and be the mother of Dragons. #MissingPenguinOfTheNorth #GoT #LOTR #HP #MIU"	False	"rivendell  middle earth "	""	""	""	""	"2011-06-29 21:33:08+00:00"	680.0	241.0	17135.0	2135.0	4.0
326489343	1	0	0	"Khaleesi"	"ZaammnJazzy"	"‘when was the last time someone touched a part of you other than your body’ #HamptonUAlumna #CharlotteSchoolofLaw"	False	"stuck in the     s  nova   sc"	""	""	""	""	"2011-06-30 00:32:39+00:00"	1249.0	1064.0	53367.0	2695.0	3.0
327225405	0	1	0	"winifred sanderson"	"amber_ward_"	"I'm the next Claire Underwood #uncc19"	False	""	""	""	""	""	"2011-07-01 06:05:08+00:00"	567.0	306.0	29118.0	36799.0	3.0
327550268	1	0	0	"khaleesi"	"izhhy_"	""	False	""	""	""	""	""	"2011-07-01 19:08:35+00:00"	351.0	258.0	11646.0	5305.0	0.0
328586354	0	1	0	"Ritchy"	"RitchysThoughts"	"A mixture of Frank Underwood, Klaus Mikaelson, and Tyrion Lannister."	False	"stamford  connecticut "	41.05343	-73.53873	"Stamford"	"US"	"2011-07-03 17:12:48+00:00"	484.0	99.0	7622.0	24944.0	0.0
329121266	0	0	1	"Fanny."	"woahsexley"	"crazy about a HELLUVA lot of (mostly fictional) human being | BOOKS nerd | #Lux #TMI #TID #TFiOS #TVD #TW #Castle #Lana #TBBT #PDubber"	False	"studying "	""	""	""	""	"2011-07-04 15:38:04+00:00"	1629.0	435.0	45602.0	1800.0	46.0
330436310	1	0	0	"khaleesi"	"JessicaRifley"	"aggressively friendly"	False	"minneapolis"	44.97997	-93.26384	"Minneapolis"	"US"	"2011-07-06 16:28:56+00:00"	302.0	234.0	4974.0	9353.0	0.0
330680130	0	0	1	"Paul Sheldon"	"paulsayzhi"	"Education Entertainment™"	False	"boise state university"	43.60294	-116.19845	"Boise State University"	"US"	"2011-07-07 00:18:27+00:00"	317.0	303.0	1609.0	939.0	0.0
331133916	0	0	1	"Tony Layfield"	"EfcBazinga"	"Best team in the world.......Everton aren't we! Big Bang, Pizza, Films. The gleam in your eye when I show you my thigh tells me you love me......"	False	"merseyside"	53.4	-3.08333	"Merseyside"	"GB"	"2011-07-07 18:05:33+00:00"	618.0	830.0	1380.0	10.0	36.0
331470880	0	1	0	"Shakti Patti Evans"	"shaktipat1"	"USC GRAD 2012. Marketing major.  Single and love to mingle. Like em Tall and Dark #teamdarkskin #empire #houseofcards #beingmaryjane"	False	"la left coast"	""	""	""	""	"2011-07-08 06:51:15+00:00"	2590.0	2401.0	812.0	0.0	7.0
331859067	0	1	0	"Cole Gill"	"cole_gillage69"	"Duck smasher!"	False	"crooked letter representer"	""	""	""	""	"2011-07-08 20:45:18+00:00"	487.0	493.0	900.0	21.0	1.0
331892138	0	1	0	"James Matthews"	"JamesJFT96"	"Liverpool FC, Yelawolf, Plan B, Shady!"	False	""	""	""	""	""	"2011-07-08 21:54:48+00:00"	233.0	719.0	932.0	1249.0	0.0
331926451	1	0	0	"Ivan and Red"	"boarsgoreswords"	"@GameOfThrones podcast hosted by @ivan_hernandez and @red_scott."	False	"san francisco"	9.99299	-84.12934	"San Francisco"	"CR"	"2011-07-08 23:11:15+00:00"	2147.0	116.0	2886.0	1475.0	48.0
331967920	0	0	1	"Dylan Coone"	"DylanCoone"	"1/2 of the coonions - never lost a dance off - mmu's best dancers - gentlemen - 1st person to ever shave dickos' eyebrow"	False	"london manchester napa"	""	""	""	""	"2011-07-09 00:49:41+00:00"	892.0	867.0	19224.0	2864.0	6.0
331978480	1	0	0	"Brittany Bolton"	"Britt_Bolton"	"•RVA • JMU • ΖΤΑ•"	False	""	""	""	""	""	"2011-07-09 01:15:01+00:00"	604.0	384.0	14505.0	7096.0	2.0
332892110	1	0	0	"Kylaerys Targaryen"	"inside_Kyle"	"I am the hero Gotham needs | @inside_kyle | Business: kyle@unii.com"	False	"boston"	42.35843	-71.05977	"Boston"	"US"	"2011-07-10 16:20:33+00:00"	372.0	131.0	9938.0	3339.0	4.0
332894696	0	1	0	"Frank Underwood Jr."	"FrankUnderwoodJ"	"#Artist, #Author of Born of Phyre and an extraordinary lover of #Life! Embrace the muchness & the spectrum of life! Follow me on Instagram @frankzmusxart"	False	"usa"	39.76	-98.5	"United States"	"US"	"2011-07-10 16:26:15+00:00"	7181.0	5256.0	3377.0	6367.0	263.0
333716386	0	0	1	"Chris Klausen"	"mikkelscott1"	"I'm an Empress of Ireland Historian and collector who wants to bring the story of Canada's Titanic to all Canadians. I work on The Big Bang Theory T.V show."	False	"canada los angeles  new york"	""	""	""	""	"2011-07-11 23:51:31+00:00"	37.0	33.0	44.0	0.0	0.0
333728630	1	0	0	"QueenSheda"	"Queen_Sheda"	"Follow Me On IG @kidkid_sheda ⛽️ Taken By The Finest"	False	""	""	""	""	""	"2011-07-12 00:19:41+00:00"	2312.0	1818.0	101866.0	9370.0	6.0
333889747	1	0	0	"khaleesi"	"ItsOnlyTywanna"	"I'm the last of my kind and that's on everything I love"	False	"  road to zion  "	""	""	""	""	"2011-07-12 07:26:32+00:00"	625.0	479.0	13881.0	2232.0	0.0
334995850	0	0	1	"."	"SheldonShearer"	"dream palace ~~~~"	False	""	""	""	""	""	"2011-07-14 00:19:47+00:00"	574.0	192.0	10375.0	6894.0	2.0
335187042	0	0	1	"kashmira"	"kashmira912"	"Traveller.adventure http://t.co/DIPQY23WBs freak. atheist.spiritual.opportunist #GoT #TVD #TBBT"	False	"goa india "	""	""	""	""	"2011-07-14 08:48:22+00:00"	54.0	104.0	297.0	206.0	2.0
335627491	1	0	0	"blacc charizard"	"SushiBoySashami"	"SUSHI BOY LIT AKA SNOW BUNNY LORD ig:sushiboysashami"	False	"cali"	3.43722	-76.5225	"Santiago de Cali"	"CO"	"2011-07-15 00:12:57+00:00"	1125.0	777.0	9914.0	9233.0	2.0
336234945	1	0	0	"Febre Martell-Crawf"	"PhoebeM_C"	""	False	""	""	""	""	""	"2011-07-15 23:38:02+00:00"	570.0	241.0	4739.0	4708.0	2.0
336620422	0	0	1	"Sheldon Cooper"	"Shelly_Cooper_"	"BAZINGA!"	False	"oh wouldn t u wanna know   "	""	""	""	""	"2011-07-16 16:19:56+00:00"	118.0	479.0	183.0	36.0	1.0
336913600	0	1	0	"James Matthew"	"James_Bites"	"Class Clown *smirks*  Unlike these other guys, I do bite *winks* {RP} {18+} Single"	False	""	""	""	""	""	"2011-07-17 03:58:18+00:00"	194.0	381.0	364.0	0.0	4.0
337050608	0	0	1	"Leonard Hofstadter"	"leonardhfstadtr"	"I am a physicist, so surely I am an expert about the big bang theory. But I'm not related to the 'The Big Bang Theory' in anyway."	False	"pasadena  california"	34.14778	-118.14452	"Pasadena"	"US"	"2011-07-17 11:03:25+00:00"	2956.0	175.0	263.0	17.0	44.0
337271239	0	0	1	"Claire Mitchell "	"The_Buffy_Bot"	"Vampires of the world beware! Pharmacist; dog lover; obsessive; nutter; prone to attacks of dumb blonde; BtVS/Spike, HIMYM, TBBT; NFFC"	False	"sheffield  uk"	53.38297	-1.4659	"Sheffield"	"GB"	"2011-07-17 19:11:23+00:00"	487.0	417.0	7242.0	1167.0	11.0
337364260	1	0	0	"lord commander snow"	"the_sean_mower"	"winter is coming"	False	""	""	""	""	""	"2011-07-17 22:32:26+00:00"	254.0	392.0	579.0	1895.0	1.0
338222911	0	0	1	"Sheldon Cooper"	"ShelldonCooperQ"	"Collection of Sheldon quotes from The Big Bang Theory. .."	False	""	""	""	""	""	"2011-07-19 07:46:36+00:00"	2016.0	2218.0	1408.0	0.0	17.0
338416602	0	1	0	"Alana Whitaker"	"ACW_27"	"Eat. Run. Travel. Repeat. #StayWild ☀️☀️☀️When I grow up, I want to be Claire Underwood."	False	"atl    sd"	""	""	""	""	"2011-07-19 15:10:03+00:00"	169.0	147.0	3592.0	547.0	5.0
339028595	0	0	1	"Sheldon Electricals"	"SheldonElect"	"Biggleswade's premier electrical retailer. Huge selection of home entertainment & domestic appliances IN STORE NOW!                    (01767) 448188"	False	"hitchin st  biggleswade  beds"	""	""	""	""	"2011-07-20 13:42:18+00:00"	2717.0	2019.0	1414.0	140.0	15.0
339493436	0	0	1	"Sheldon Cooper"	"sonofMaryCooper"	"Dr. Sheldon Lee Cooper MSc, PhD. Theoretical physicist. I have a masters and 2 PhD's. #BigBangTheory  Play #ThatsMySpot  - http://t.co/4FJZzJK5Jh"	False	"caltech  pasadena  california"	""	""	""	""	"2011-07-21 05:47:03+00:00"	66800.0	12.0	12185.0	655.0	136.0
339501173	0	0	1	"Dan Huizinga"	"Bazinga43372401"	"Cutler"	False	""	""	""	""	""	"2011-07-21 06:10:26+00:00"	318.0	295.0	1917.0	764.0	0.0
339790305	1	0	0	"Kelly Martell"	"KellyMartellFit"	"I Help People Who Struggle With Their Weight, To Stop Dieting, And Be Happy In Their Own Body"	False	"rohnert park  ca"	38.33964	-122.7011	"Rohnert Park"	"US"	"2011-07-21 17:21:57+00:00"	602.0	1142.0	5270.0	115.0	3.0
339976193	1	0	0	"Irfan Mughal"	"TheIrfanMughal"	"SHAH RUKH KHAN,
DEEPIKA PADUKONE AND ANUSHKA SHARMA. HUGE FAN OF GAME OF THRONES! LOVE LOVE CARICE VAN HOUTEN @caricevhouten"	False	"london"	51.50853	-0.12574	"London"	"GB"	"2011-07-21 23:34:50+00:00"	565.0	98.0	30432.0	2400.0	3.0
340284650	0	1	0	"James Matthews"	"Jammat1980"	""	False	""	""	""	""	""	"2011-07-22 13:05:47+00:00"	27.0	73.0	143.0	8.0	0.0
340412903	1	0	0	"مصبح القايدي"	"Musabah_Alqaydi"	"Engineering student, 8/3, 20 yrs, obsessed with Arya Stark. اللهم إرحم أخي و أبي و أجمعني بهم في جنتك"	False	"abu dhabi  united arab emirates"	""	""	""	""	"2011-07-22 17:17:47+00:00"	3296.0	1418.0	24695.0	1390.0	5.0
340502509	0	0	1	"suz"	"spfffr"	"time is money. money is power. power is pizza. pizza is knowledge. let's go - april ludgate"	False	""	""	""	""	""	"2011-07-22 20:15:09+00:00"	267.0	192.0	1510.0	977.0	0.0
341112483	0	1	0	"Matthew"	"HonMatthewJames"	"Snowboarder, engineer, geek, technology wizard & whimsical adventurer. I spend summers on the oceans and winters in the mountains."	False	"wrightington  england"	53.59771	-2.7213	"Wrightington"	"GB"	"2011-07-23 20:40:16+00:00"	26.0	64.0	187.0	1.0	1.0
341556501	0	1	0	"James Matthew. "	"MatthewJFlyzik"	"You're my definition of perfect."	False	""	""	""	""	""	"2011-07-24 15:23:23+00:00"	275.0	53.0	2735.0	42.0	2.0
341667860	0	0	1	"Boss Bitch Tips ♛"	"OfficialBBT_"	"The ORIGINAL, ONE & ONLY, Boss Bitch Tips. Our OFFICIAL & ONLY twitter. Often imitated, never duplicated. #BOSSYMAFIA #BossBitchTakeover"	False	""	""	""	""	""	"2011-07-24 19:15:57+00:00"	13300.0	1718.0	2481.0	200.0	74.0
341705265	1	0	0	"Val"	"Val_Wildling"	"I'm the sister of Mance Rayder's wife, currently stuck at Castle Black.  Not affiliated with HBO or Game of Thrones.  Will try to avoid spoilers"	False	"castle black"	42.51665	-92.39365	"Town of Castle Hill (historical)"	"US"	"2011-07-24 20:34:42+00:00"	291.0	223.0	261.0	0.0	8.0
342053618	1	0	0	"Sophie's Japan Blog"	"SengokuSophie"	"Aspiring writer and Japan blogger. Loves Japan, books, samurai, cats and Game of Thrones."	False	"london  uk"	51.50853	-0.12574	"London"	"GB"	"2011-07-25 12:01:25+00:00"	1104.0	1796.0	5349.0	73.0	51.0
342136851	1	0	0	"Jaime Lannister"	"dellmar11"	"There are no men like me, only me"	False	"westeros"	""	""	""	""	"2011-07-25 15:02:59+00:00"	118.0	167.0	1167.0	59.0	2.0
342327664	1	0	0	"bex"	"rebekasayshi"	"I am Daenerys of House Targaryen"	False	"northern ireland "	53.0	-8.0	"Ireland"	"IE"	"2011-07-25 20:54:35+00:00"	637.0	533.0	20445.0	63.0	2.0
342348938	1	0	0	"Amber Albe"	"AmberAlbe"	"be the person you needed when you were younger.
ecsu"	False	"wlfd"	""	""	""	""	"2011-07-25 21:38:15+00:00"	592.0	653.0	15334.0	3321.0	2.0
342394823	1	0	0	"Khaleesi"	"ariana_velazco"	"Food and Netflix enthusiast"	False	"new brunswick"	46.5001	-65.99878	"New Brunswick"	"CA"	"2011-07-25 23:17:07+00:00"	285.0	495.0	6837.0	9487.0	3.0
342829717	0	0	1	"Big Bang Theory "	"BigBangTheory_Q"	"All of your favorite quote from The Big Bang Theory, daily."	False	""	""	""	""	""	"2011-07-26 17:04:34+00:00"	74.0	22.0	17.0	0.0	2.0
342848871	0	0	1	"Shelly-T"	"Sheldon_77"	"20. I love Sports and Shoes. Be the change you want to see in the world. #OUfootball #CarolinaPanthers #teamLeBron #RedSox #moneyteam #LNO RIP Kacey, RIP Cliff."	False	"     nw expressway "	35.54701	-97.61288	"Fairfield Inn & Suites Oklahoma City Nw Expressway Warr Acres"	"US"	"2011-07-26 17:39:38+00:00"	988.0	866.0	29541.0	1711.0	2.0
344392326	1	0	0	"Nick Martell"	"NickMartell11"	"Take it Sleazy"	False	""	""	""	""	""	"2011-07-29 00:30:20+00:00"	223.0	194.0	1503.0	1114.0	0.0
344462489	1	0	0	"vicky martell"	"Vickysm22"	"just keep swimming #teammanny #spearsarcoma"	False	""	""	""	""	""	"2011-07-29 03:05:41+00:00"	501.0	505.0	4878.0	3930.0	2.0
344855599	0	0	1	"Sheldon Rempal"	"rempal_11"	"#11 nanaimo clippers | Clarkson/2016 - fun times with friends. | insta - @sheldonrempal"	False	""	""	""	""	""	"2011-07-29 17:57:29+00:00"	351.0	194.0	610.0	296.0	2.0
345558337	1	0	0	"Theon Greyjoy"	"patrickschools8"	"I like video games"	False	"horsham pa"	40.19928	-75.16646	"Horsham Township"	"US"	"2011-07-30 20:02:29+00:00"	154.0	194.0	1992.0	729.0	0.0
346286899	1	0	0	"Khaleesi Tarrant"	"ivoreeanoamp"	"CSUSM➖ΑΟΠ❤️ #SLIW"	False	""	""	""	""	""	"2011-08-01 01:21:35+00:00"	378.0	372.0	11554.0	10369.0	4.0
346376443	1	0	0	"andrea wood"	"andreawoodx"	"I don't mind if you don't mind"	False	""	""	""	""	""	"2011-08-01 04:57:57+00:00"	486.0	279.0	15358.0	12611.0	1.0
347028160	0	0	1	"Sean Sheldon"	"B_IGSean"	"I told God tell me what you want me to be and I'll be it. There's a light and I see it."	False	"the burg via the mitten  "	""	""	""	""	"2011-08-02 05:17:58+00:00"	1044.0	561.0	8618.0	4160.0	3.0
347084580	1	0	0	"Vinny Lannister"	"vinnysaidwhaa"	"La Sallian |CA| Weird since '96|@fredoughnut's❤️"	False	"casterly rock"	""	""	""	""	"2011-08-02 07:47:34+00:00"	191.0	488.0	3090.0	1459.0	0.0
347506891	1	0	0	"Arya Stark"	"Ready_Becc"	"Probably laughing at you,not with you. Sligonian.Student at NUIG.Popcorn and Music enthusiast.Both lactose and bullshit intolerant."	False	"galway ireland"	53.27194	-9.04889	"Galway"	"IE"	"2011-08-02 22:20:40+00:00"	137.0	217.0	6300.0	1382.0	0.0
347604029	0	0	1	"sheldon cooper"	"madgee_"	"Frankie cocozza=perfectionnn!!! Christopher dreww=gorgouesess. sheldon cooper=amazing Asking alexandria&all time low!!"	False	""	""	""	""	""	"2011-08-03 02:03:35+00:00"	162.0	418.0	418.0	8.0	0.0
348083218	0	0	1	"50 shades of Ginger"	"GingeSwagTia"	"17 I am an aspiring Film maker who is also a #Sheerio #Sherlockian #Marvel #Fannable #BrBa #TimeLord I also go to #Hogwarts  Bazinga"	False	"london"	51.50853	-0.12574	"London"	"GB"	"2011-08-03 21:10:42+00:00"	2048.0	1716.0	4624.0	416.0	2.0
348125300	0	1	0	"Garrett Walker"	"iGarrettWalker"	"enjoying every moment of my blessed life"	False	"missouri  usa"	38.25031	-92.50046	"Missouri"	"US"	"2011-08-03 22:39:18+00:00"	547.0	290.0	1756.0	2344.0	0.0
348627707	0	0	1	"sheldon"	"shelbykers"	"WBL • UMN"	False	"mpls  mn"	44.8651	-93.4209	"Hampton Inn Mpls-Eden Prairie"	"US"	"2011-08-04 18:53:52+00:00"	677.0	596.0	9421.0	15751.0	2.0
348639750	1	0	0	"Morgan"	"MorganTargaryen"	"I'll take what is mine with fire and blood."	False	"probably hell"	""	""	""	""	"2011-08-04 19:17:30+00:00"	232.0	223.0	11743.0	1974.0	0.0
348696966	0	0	1	"LADY_GORGEOUS"	"LADY_BBT"	"Yaaahhhh , Im Bckkk ! 3"	False	""	""	""	""	""	"2011-08-04 21:14:30+00:00"	237.0	248.0	4857.0	15.0	0.0
348751658	1	0	0	"Kerr Logan"	"KerrLogan"	"London Irish. Game of Thrones. Good Vibrations. The Crimson Field. Kelly Jones promised me some gig tickets once."	False	""	""	""	""	""	"2011-08-04 23:12:34+00:00"	2006.0	187.0	969.0	101.0	33.0
349326966	1	0	0	"Eric Bowen"	"eric_bowen"	"Phoenix ascendant. Executive director at @BreadRiotNC. Also @HelenChappell's widower and a toddler's dad. Valar dohaeris."	False	"salisbury  nc"	35.67097	-80.47423	"Salisbury"	"US"	"2011-08-05 22:54:56+00:00"	1039.0	1474.0	4580.0	1159.0	59.0
349867043	0	0	1	"Sheldon. Gajarian"	"shskbob"	"Assignment Manager for KMPH Fox 26 News. Send me story ideas newsdesk@kmph.com"	False	""	""	""	""	""	"2011-08-06 20:49:39+00:00"	594.0	114.0	1281.0	6.0	19.0
349881900	1	0	0	"oberyn martell"	"sean_fpeterside"	""	False	"keele  england"	53.00628	-2.28686	"Keele"	"GB"	"2011-08-06 21:20:28+00:00"	469.0	439.0	16737.0	520.0	0.0
349932090	1	0	0	"Oberyn Martell"	"ViperOberyn"	"Prince Oberyn Nymeros Martell, the Red Viper of Dorne. Not affiliated with GRRM or HBO, only with #FakeWesteros and vengeance. Currently resting in pieces."	False	"king s landing"	47.75622	-122.20567	"Chateau at Bothell Landing"	"US"	"2011-08-06 23:10:15+00:00"	1711.0	725.0	1629.0	190.0	28.0
350819487	0	1	0	"James Matthews"	"jmatt11_"	""	False	""	""	""	""	""	"2011-08-08 10:52:07+00:00"	369.0	596.0	1001.0	490.0	0.0
350931134	0	0	1	"sheldon smart"	"DrSheldizy"	""	False	""	""	""	""	""	"2011-08-08 14:48:23+00:00"	61.0	288.0	499.0	79.0	0.0
351071311	0	0	1	"Ashley Wong "	"BazingaAshley"	""	False	""	""	""	""	""	"2011-08-08 19:02:18+00:00"	237.0	187.0	3428.0	8887.0	0.0
351885454	0	1	0	"Peter J Russo"	"PeterJRuss"	"If you laugh, you think, and you cry, that's a full day. That's a heck of a day. You do that seven days a week, you're going to have something special -Jimmy V"	False	""	""	""	""	""	"2011-08-09 21:23:31+00:00"	457.0	343.0	24507.0	5257.0	0.0
351976766	0	1	0	"Paulette Light"	"paulettelight"	"Co-founder & CEO of @Mom_Stamp, mom of 4, manager of chaos, carpool maven, logistics wizard, house of cards protector, insomniac"	False	""	""	""	""	""	"2011-08-10 00:04:52+00:00"	2514.0	284.0	562.0	290.0	16.0
352028301	0	1	0	"B. Linda Vasquez"	"BLVasquezPRpro"	"City living & loving every minute of it! Multicultural Public Relations Professional. Miami Native - I enjoy traveling and spending time with my pug, Noel."	False	"los angeles"	34.05223	-118.24368	"Los Angeles"	"US"	"2011-08-10 01:47:21+00:00"	21.0	79.0	95.0	0.0	0.0
352310937	0	0	1	"Jason Sheldon"	"_Jazzie_"	"Photographer. Likes to moan a lot, especially about refuse collection.
Personal account of @junction10"	False	"wherever my hat is "	""	""	""	""	"2011-08-10 12:54:46+00:00"	170.0	245.0	855.0	3.0	4.0
352706799	1	0	0	"Maria Targaryen"	"HylianMaria"	"@HeroOfTime__'s Sister. #Slytherin ❤Tolkien, Star Wars, LoZ, Fire Emblem, Pokemon, Dragons, GoT, Villains, British accents, coffee,I'm a Writer"	False	"nohr"	11.93333	107.35	"Da N’ohr"	"VN"	"2011-08-11 00:14:17+00:00"	1246.0	1006.0	17589.0	360.0	13.0
352718305	1	0	0	"The Drowned God"	"TheDrownedGod"	"Sea God affiliated with the IronMen of Westeros but Not affiliated w/ HBO® or Game of Thrones"	False	"watery halls"	""	""	""	""	"2011-08-11 00:36:39+00:00"	1639.0	1989.0	1690.0	284.0	35.0
353141144	1	0	0	"Sam Martel"	"sammartel"	"NVHS 17| Chicago Fury AAA Hockey U18 #4| Fargo Force Affiliate"	False	""	""	""	""	""	"2011-08-11 16:21:10+00:00"	705.0	397.0	2389.0	6047.0	0.0
353299589	0	0	1	"Haley Sheldon"	"HaleyMay2015"	"Texas A&M University, 2015|| saved by grace|| I like to think of myself as an optimist"	False	""	""	""	""	""	"2011-08-11 21:23:04+00:00"	342.0	361.0	3613.0	2300.0	1.0
353899159	1	0	0	"Void Targaryen"	"curranc08"	""	False	""	""	""	""	""	"2011-08-12 20:24:23+00:00"	280.0	888.0	13946.0	7538.0	5.0
354386615	1	0	0	"ruby ✌️"	"rubymcilroyox"	"♡ nineteen | @benmonnox | university of essex | game of thrones | snapchat: rubymcilroy ♡"	False	"gloucester colchester"	""	""	""	""	"2011-08-13 16:44:08+00:00"	2287.0	2265.0	22928.0	2374.0	6.0
354621137	1	0	0	"JCSOD Bolton"	"jcdancebolton"	"Quality dance training"	False	"bolton on"	47.85288	-81.02868	"Bolton Lake"	"CA"	"2011-08-14 01:23:16+00:00"	305.0	201.0	722.0	100.0	1.0
354643160	1	0	0	"Khaleesi"	"mariajulieta10"	"teenagers scare the living shit out of me ✖️"	False	""	""	""	""	""	"2011-08-14 02:16:47+00:00"	536.0	321.0	14219.0	4101.0	0.0
354650732	0	0	1	"sheldon richardson "	"showmeboi314"	"I'm a senior DT for the mizzou tigers.......ENOUGH SAID!!!!!!"	False	"mizzou"	39.10168	-93.75022	"Lake Mizzou Dam"	"US"	"2011-08-14 02:35:13+00:00"	1484.0	38.0	50.0	0.0	30.0
354895660	0	0	1	"Pete Brooksbank"	"petebrooksbank"	"I'm the guy you see watching Big Bang Theory at the gym."	False	"nottingham  via boston "	""	""	""	""	"2011-08-14 13:52:13+00:00"	311.0	826.0	3879.0	849.0	2.0
354923920	1	0	0	"Ned_Stark"	"Ned_Stark97"	""	False	"luton town "	""	""	""	""	"2011-08-14 14:47:04+00:00"	35.0	60.0	194.0	25.0	0.0
